{
  "title": "Test Title",
  "icon": "TestIcon.icns",
  "background": "TestBkg.png",
  "icon-size": 80,
  "contents": [
    { "x": 448, "y": 344, "type": "link", "path": "/Applications" },
    { "x": 192, "y": 344, "type": "file", "path": "TestApp.app" },
    { "x": 512, "y": 128, "type": "file", "path": "TestDoc.txt" }
  ]
}
